<?xml version="1.0" encoding="UTF-8"?>
<!--Sample XML file generated by XML Spy v4.4 U (http://www.xmlspy.com)-->
<Registration xmlns:xsi="http://www.w3.org/2001/XMLSchema-instance" xsi:noNamespaceSchemaLocation="..\..\schema\Registration.xsd">
	<HostName>__HOST__</HostName>
	<AppType>eManager</AppType>
	<AppInstance>app</AppInstance>
	<AppVersion>__EMANAGER_VERSION__</AppVersion>
	<AppMgmtPolicies/>
	<Logging>
		<LogDirectories>
			<LogDirectory>__EMHOME__/logs</LogDirectory>
			<LogDirectory>__EMHOME__/tomcat/logs</LogDirectory>
			<LogDirectory>__EMHOME__/3rdparty/hawk/log</LogDirectory>
		</LogDirectories>
	</Logging>
</Registration>
