<?xml version="1.0" encoding="UTF-8"?>
<!-- edited with XML Spy v4.4 U (http://www.xmlspy.com) by Wm. Mark Stubbeman (Cisco Systems, Inc.) -->
<!--Sample XML file generated by XML Spy v4.4 U (http://www.xmlspy.com)-->
<Registration xmlns:xsi="http://www.w3.org/2001/XMLSchema-instance" xsi:noNamespaceSchemaLocation="S:\vws\root\wstubb-snap-emanager-main\emanager\schema\Registration.xsd">
	<HostName>wstubb-u60.cisco.com</HostName>
	<AppType>MarcoTestAppType</AppType>
	<AppInstance>MarcoTestAppInstance</AppInstance>
	<AppVersion>1.0.0</AppVersion>
	<AppMgmtPolicies>
		<AppMgmtPolicy>/vob/emanager/sdk/client/tibco/inventory/MarcoTest.hrb</AppMgmtPolicy>
	</AppMgmtPolicies>
	<Logging>
		<LogDirectories>
			<LogDirectory>String</LogDirectory>
		</LogDirectories>
	</Logging>
</Registration>
