<?xml version="1.0" encoding="UTF-8"?>
<!--Sample XML file generated by XML Spy v4.4 U (http://www.xmlspy.com)-->
<Registration xmlns:xsi="http://www.w3.org/2001/XMLSchema-instance" xsi:noNamespaceSchemaLocation="..\..\schema\Registration.xsd">
	<HostName>sunfire-v880</HostName>
	<AppType>TestApp</AppType>
	<AppInstance>TestAppInst</AppInstance>
	<AppVersion>1.0.0</AppVersion>
	<AppMgmtPolicies/>
	<ProcessPropertyFile>/opt/CSCOemgmt/sdk/process/test_application/config/TestApp.processSequencer.properties</ProcessPropertyFile>
	<Logging>
		<LogDirectories>
			<LogDirectory>/opt/CSCOemgmt/sdk/process/test_application/bin</LogDirectory>
		</LogDirectories>
	</Logging>
</Registration>
